{
  "version": "0.1",
  "run_id": "run_0d532a1528",
  "kernel_version": "0.1",
  "artifacts": [
    {
      "path": "C:/Users/mateo/labtrust-portfolio/datasets/runs/meta_eval/robustness_campaign/regime_stress_v0/hysteresis_ablation/h3/meta/seed_16/trace.json",
      "sha256": "cd3f073370de9676bab15392c3d720a7221a758a21c14975b38fdcaca7999168",
      "schema_id": "https://example.org/labtrust/kernel/trace/TRACE.v0.1"
    },
    {
      "path": "C:/Users/mateo/labtrust-portfolio/datasets/runs/meta_eval/robustness_campaign/regime_stress_v0/hysteresis_ablation/h3/meta/seed_16/maestro_report.json",
      "sha256": "f5e52070bc0a6452f35dc8ab943b475a194b8b663662071085e971411dce607f",
      "schema_id": "https://example.org/labtrust/kernel/eval/MAESTRO_REPORT.v0.2"
    }
  ],
  "verification": {
    "schema_validation_ok": true,
    "replay_ok": true,
    "replay_diagnostics": "replay ok"
  },
  "verification_mode": "evaluator"
}
