{
  "version": "0.1",
  "run_id": "run_7f47090fef",
  "kernel_version": "0.1",
  "artifacts": [
    {
      "path": "C:/Users/mateo/labtrust-portfolio/datasets/runs/p0_e4_matrix/normalized/baseline/rep_cps_scheduling_v0/centralized/seed_16/trace.json",
      "sha256": "d6374b7f48ffa9a518e0f5ab8cb13f07874c33fce89ff383e7ba97cf46e93c10",
      "schema_id": "https://example.org/labtrust/kernel/trace/TRACE.v0.1"
    },
    {
      "path": "C:/Users/mateo/labtrust-portfolio/datasets/runs/p0_e4_matrix/normalized/baseline/rep_cps_scheduling_v0/centralized/seed_16/maestro_report.json",
      "sha256": "f385f52ef69e526e0ea85aaf64b65305991cd3bd3bdfee1eaf2e1937f71a444e",
      "schema_id": "https://example.org/labtrust/kernel/eval/MAESTRO_REPORT.v0.2"
    }
  ],
  "verification": {
    "schema_validation_ok": true,
    "replay_ok": true,
    "replay_diagnostics": "replay ok"
  },
  "verification_mode": "evaluator"
}
