{
  "version": "0.1",
  "run_id": "run_deccc5b6b5",
  "kernel_version": "0.1",
  "artifacts": [
    {
      "path": "C:/Users/mateo/labtrust-portfolio/datasets/runs/p0_e4_matrix/normalized/baseline/rep_cps_scheduling_v0/rep_cps/seed_3/trace.json",
      "sha256": "f2e549b50cc0ed8c1af33646c2e5c5e2371a882c54b8c22e511e50832b00cc71",
      "schema_id": "https://example.org/labtrust/kernel/trace/TRACE.v0.1"
    },
    {
      "path": "C:/Users/mateo/labtrust-portfolio/datasets/runs/p0_e4_matrix/normalized/baseline/rep_cps_scheduling_v0/rep_cps/seed_3/maestro_report.json",
      "sha256": "fb8f419643f282d12a348b5661218872e3ef356ebd581f524b6d65768a7c1118",
      "schema_id": "https://example.org/labtrust/kernel/eval/MAESTRO_REPORT.v0.2"
    }
  ],
  "verification": {
    "schema_validation_ok": true,
    "replay_ok": true,
    "replay_diagnostics": "replay ok"
  },
  "verification_mode": "evaluator"
}
