{
  "version": "0.1",
  "run_id": "run_d6f53aa0f3",
  "kernel_version": "0.1",
  "artifacts": [
    {
      "path": "C:/Users/mateo/labtrust-portfolio/datasets/runs/p0_e4_matrix/raw/moderate/lab_profile_v0/rep_cps/seed_19/trace.json",
      "sha256": "ec446590e03b140608d64c770dd787b0304d55629023d038eb011a595d669be6",
      "schema_id": "https://example.org/labtrust/kernel/trace/TRACE.v0.1"
    },
    {
      "path": "C:/Users/mateo/labtrust-portfolio/datasets/runs/p0_e4_matrix/raw/moderate/lab_profile_v0/rep_cps/seed_19/maestro_report.json",
      "sha256": "d38105d420017ac968386454e1dc2d862a9368694f72166d3708e64421879dad",
      "schema_id": "https://example.org/labtrust/kernel/eval/MAESTRO_REPORT.v0.2"
    }
  ],
  "verification": {
    "schema_validation_ok": true,
    "replay_ok": true,
    "replay_diagnostics": "replay ok"
  },
  "verification_mode": "evaluator"
}
