{
  "version": "0.1",
  "run_id": "run_58fdc479c7",
  "kernel_version": "0.1",
  "artifacts": [
    {
      "path": "C:/Users/mateo/labtrust-portfolio/datasets/runs/meta_eval/robustness_campaign/regime_stress_v0/sweep/collapse_sweep/drop_0.25/seed_13/trace.json",
      "sha256": "88f7134ce3c93ec1dc4883400139f12dccb3be026e938e147c1c4222326f3a84",
      "schema_id": "https://example.org/labtrust/kernel/trace/TRACE.v0.1"
    },
    {
      "path": "C:/Users/mateo/labtrust-portfolio/datasets/runs/meta_eval/robustness_campaign/regime_stress_v0/sweep/collapse_sweep/drop_0.25/seed_13/maestro_report.json",
      "sha256": "da623f69469520da3082f4a44b423aa78cafc08422bb733fdac8c79b632623cb",
      "schema_id": "https://example.org/labtrust/kernel/eval/MAESTRO_REPORT.v0.2"
    }
  ],
  "verification": {
    "schema_validation_ok": true,
    "replay_ok": true,
    "replay_diagnostics": "replay ok"
  },
  "verification_mode": "evaluator"
}
