{
  "version": "0.1",
  "run_id": "run_1479f454b4",
  "kernel_version": "0.1",
  "artifacts": [
    {
      "path": "datasets/runs/meta_eval/robustness_campaign/regime_stress_v1/sweep/collapse_sweep/drop_0.25/seed_17/trace.json",
      "sha256": "95fbc25bcdd2825b3ae86e5e57a514e4b02c52427421d35cca729932c7494f5d",
      "schema_id": "https://example.org/labtrust/kernel/trace/TRACE.v0.1"
    },
    {
      "path": "datasets/runs/meta_eval/robustness_campaign/regime_stress_v1/sweep/collapse_sweep/drop_0.25/seed_17/maestro_report.json",
      "sha256": "2ccffca755e55c532ace8d5a7a259f89546a0a807e48d089a03b231d4eb3e79a",
      "schema_id": "https://example.org/labtrust/kernel/eval/MAESTRO_REPORT.v0.2"
    }
  ],
  "verification": {
    "schema_validation_ok": true,
    "replay_ok": true,
    "replay_diagnostics": "replay ok"
  },
  "verification_mode": "evaluator"
}
