{
  "version": "0.1",
  "run_id": "run_217e48f289",
  "kernel_version": "0.1",
  "artifacts": [
    {
      "path": "datasets/runs/meta_eval/robustness_campaign/regime_stress_v1/hysteresis_ablation/h1/fixed/seed_11/trace.json",
      "sha256": "d24124f0675df096fa599d237a56d1b854829f70aa12eb41ebd6efce9cc2060a",
      "schema_id": "https://example.org/labtrust/kernel/trace/TRACE.v0.1"
    },
    {
      "path": "datasets/runs/meta_eval/robustness_campaign/regime_stress_v1/hysteresis_ablation/h1/fixed/seed_11/maestro_report.json",
      "sha256": "07cd62c41980f5886cc5820145e2f1d039d67dd14238f271695748bfe847400f",
      "schema_id": "https://example.org/labtrust/kernel/eval/MAESTRO_REPORT.v0.2"
    }
  ],
  "verification": {
    "schema_validation_ok": true,
    "replay_ok": true,
    "replay_diagnostics": "replay ok"
  },
  "verification_mode": "evaluator"
}
