{
  "version": "0.1",
  "run_id": "run_2f77c1ae13",
  "kernel_version": "0.1",
  "artifacts": [
    {
      "path": "datasets/runs/meta_eval/meta/seed_27/trace.json",
      "sha256": "acc8acb5ff3e016ff99d1dadc4e035b5a2c1164852b075e95a4b3905695a7d9d",
      "schema_id": "https://example.org/labtrust/kernel/trace/TRACE.v0.1"
    },
    {
      "path": "datasets/runs/meta_eval/meta/seed_27/maestro_report.json",
      "sha256": "9176dde1413227716ca0bb1d14ab0e1d068f33b14d697ca6b937c6d0926b288f",
      "schema_id": "https://example.org/labtrust/kernel/eval/MAESTRO_REPORT.v0.2"
    }
  ],
  "verification": {
    "schema_validation_ok": true,
    "replay_ok": true,
    "replay_diagnostics": "replay ok"
  },
  "verification_mode": "evaluator"
}
