{
  "version": "0.1",
  "run_id": "run_630ee18f99",
  "kernel_version": "0.1",
  "artifacts": [
    {
      "path": "C:/Users/mateo/labtrust-portfolio/datasets/runs/p0_e4_matrix/raw/moderate/toy_lab_v0/rep_cps/seed_12/trace.json",
      "sha256": "56a789ece78d366db6257f78a5f887bb5a5f87ad64b4ba54fd509374d51a734c",
      "schema_id": "https://example.org/labtrust/kernel/trace/TRACE.v0.1"
    },
    {
      "path": "C:/Users/mateo/labtrust-portfolio/datasets/runs/p0_e4_matrix/raw/moderate/toy_lab_v0/rep_cps/seed_12/maestro_report.json",
      "sha256": "6eeb218b348de3a9a837a174bdc1f70fecb8f535a9f16faf797accff3644fec6",
      "schema_id": "https://example.org/labtrust/kernel/eval/MAESTRO_REPORT.v0.2"
    }
  ],
  "verification": {
    "schema_validation_ok": true,
    "replay_ok": true,
    "replay_diagnostics": "replay ok"
  },
  "verification_mode": "evaluator"
}
