{
  "version": "0.1",
  "run_id": "run_d44ebed466",
  "kernel_version": "0.1",
  "artifacts": [
    {
      "path": "C:/Users/mateo/labtrust-portfolio/datasets/runs/p0_e4_matrix/raw/coordination_shock/lab_profile_v0/centralized/seed_14/trace.json",
      "sha256": "7ccbe44374534c3ee7fa5743c64e1cde989b4790e35e2b5b09ad28ced7139be6",
      "schema_id": "https://example.org/labtrust/kernel/trace/TRACE.v0.1"
    },
    {
      "path": "C:/Users/mateo/labtrust-portfolio/datasets/runs/p0_e4_matrix/raw/coordination_shock/lab_profile_v0/centralized/seed_14/maestro_report.json",
      "sha256": "2ddf93295fc1b6dc11032a194826b7359e32852d61f16c85d48c6e68b0b44f03",
      "schema_id": "https://example.org/labtrust/kernel/eval/MAESTRO_REPORT.v0.2"
    }
  ],
  "verification": {
    "schema_validation_ok": true,
    "replay_ok": true,
    "replay_diagnostics": "replay ok"
  },
  "verification_mode": "evaluator"
}
