{
  "version": "0.1",
  "run_id": "run_bb3206aec8",
  "kernel_version": "0.1",
  "artifacts": [
    {
      "path": "C:/Users/mateo/labtrust-portfolio/datasets/runs/meta_eval/robustness_campaign/regime_stress_v1/baseline_non_vacuous/naive/seed_19/fallback_run/trace.json",
      "sha256": "ffaa49edb7d9f5c59df78911545c306803e4e652e8f679d2bc2096a5a5baf99e",
      "schema_id": "https://example.org/labtrust/kernel/trace/TRACE.v0.1"
    },
    {
      "path": "C:/Users/mateo/labtrust-portfolio/datasets/runs/meta_eval/robustness_campaign/regime_stress_v1/baseline_non_vacuous/naive/seed_19/fallback_run/maestro_report.json",
      "sha256": "a22c74869e95d90bb58a6a7cf1fbde958a2f0533118bda3fb127c9e5888775a6",
      "schema_id": "https://example.org/labtrust/kernel/eval/MAESTRO_REPORT.v0.2"
    }
  ],
  "verification": {
    "schema_validation_ok": true,
    "replay_ok": true,
    "replay_diagnostics": "replay ok"
  },
  "verification_mode": "evaluator"
}
