{
  "version": "0.1",
  "run_id": "run_8881b60c0e",
  "kernel_version": "0.1",
  "artifacts": [
    {
      "path": "datasets/runs/meta_eval/meta/seed_28/trace.json",
      "sha256": "b68572aa35b64a9117941658d45b12d754febb56e906179032f3c30c06abca1d",
      "schema_id": "https://example.org/labtrust/kernel/trace/TRACE.v0.1"
    },
    {
      "path": "datasets/runs/meta_eval/meta/seed_28/maestro_report.json",
      "sha256": "2c19d71f02b6a37b0e39f08f7199628bcd9a068ab595e8e08e7f74c68f158cea",
      "schema_id": "https://example.org/labtrust/kernel/eval/MAESTRO_REPORT.v0.2"
    }
  ],
  "verification": {
    "schema_validation_ok": true,
    "replay_ok": true,
    "replay_diagnostics": "replay ok"
  },
  "verification_mode": "evaluator"
}
