{
  "version": "0.1",
  "run_id": "run_f00c277a5d",
  "kernel_version": "0.1",
  "artifacts": [
    {
      "path": "datasets/runs/meta_eval/robustness_campaign/regime_stress_v0/contention_sensitive/meta/seed_13/trace.json",
      "sha256": "dfbb53da02b34fe4b486e624a45d6b1333792bf00f114f3356e00f381c60c983",
      "schema_id": "https://example.org/labtrust/kernel/trace/TRACE.v0.1"
    },
    {
      "path": "datasets/runs/meta_eval/robustness_campaign/regime_stress_v0/contention_sensitive/meta/seed_13/maestro_report.json",
      "sha256": "c9e67bf2762c61d24bc29709b8434ea2554ac2206af6e0efd1c3ff7686053f50",
      "schema_id": "https://example.org/labtrust/kernel/eval/MAESTRO_REPORT.v0.2"
    }
  ],
  "verification": {
    "schema_validation_ok": true,
    "replay_ok": true,
    "replay_diagnostics": "replay ok"
  },
  "verification_mode": "evaluator"
}
