{
  "version": "0.1",
  "run_id": "run_e3fb7f0a12",
  "kernel_version": "0.1",
  "artifacts": [
    {
      "path": "C:/Users/mateo/labtrust-portfolio/datasets/runs/p0_e4_matrix/normalized/baseline/toy_lab_v0/rep_cps/seed_7/trace.json",
      "sha256": "a0c7e69d5eeda2971c074e36696c9ff16ec3f39a2764918b26aaaae71c2f68da",
      "schema_id": "https://example.org/labtrust/kernel/trace/TRACE.v0.1"
    },
    {
      "path": "C:/Users/mateo/labtrust-portfolio/datasets/runs/p0_e4_matrix/normalized/baseline/toy_lab_v0/rep_cps/seed_7/maestro_report.json",
      "sha256": "d20884e000609b85d67fd9a16efb76b34751eafa7a8bd892fa908a289e0e5963",
      "schema_id": "https://example.org/labtrust/kernel/eval/MAESTRO_REPORT.v0.2"
    }
  ],
  "verification": {
    "schema_validation_ok": true,
    "replay_ok": true,
    "replay_diagnostics": "replay ok"
  },
  "verification_mode": "evaluator"
}
