{
  "version": "0.1",
  "run_id": "run_119b12a4dc",
  "kernel_version": "0.1",
  "artifacts": [
    {
      "path": "C:/Users/mateo/labtrust-portfolio/datasets/runs/meta_eval/robustness_campaign/regime_stress_v0/hysteresis_ablation/h3/meta/seed_7/fallback_run/trace.json",
      "sha256": "4a38d2b53973285e923eb672cc6b17df36d886b5f944a4e8d55d07844d0a4d8b",
      "schema_id": "https://example.org/labtrust/kernel/trace/TRACE.v0.1"
    },
    {
      "path": "C:/Users/mateo/labtrust-portfolio/datasets/runs/meta_eval/robustness_campaign/regime_stress_v0/hysteresis_ablation/h3/meta/seed_7/fallback_run/maestro_report.json",
      "sha256": "e88ae67766b392b3160f1a70e2cebb7d1a098663159f2973f0f24dd968f8adf0",
      "schema_id": "https://example.org/labtrust/kernel/eval/MAESTRO_REPORT.v0.2"
    }
  ],
  "verification": {
    "schema_validation_ok": true,
    "replay_ok": true,
    "replay_diagnostics": "replay ok"
  },
  "verification_mode": "evaluator"
}
