{
  "version": "0.1",
  "run_id": "run_d18b677aa1",
  "kernel_version": "0.1",
  "artifacts": [
    {
      "path": "datasets/runs/meta_eval/scenario_lab_profile_v0/fixed/seed_12/trace.json",
      "sha256": "7468ff25543fc9a09fe16349e6fe0cba1e68c69ca35636b0bac09fd0d326938e",
      "schema_id": "https://example.org/labtrust/kernel/trace/TRACE.v0.1"
    },
    {
      "path": "datasets/runs/meta_eval/scenario_lab_profile_v0/fixed/seed_12/maestro_report.json",
      "sha256": "fa880feabbfd1e074e5476d3110b923281fb76431a22ef8ab6e7d4bd9fca78ea",
      "schema_id": "https://example.org/labtrust/kernel/eval/MAESTRO_REPORT.v0.2"
    }
  ],
  "verification": {
    "schema_validation_ok": true,
    "replay_ok": true,
    "replay_diagnostics": "replay ok"
  },
  "verification_mode": "evaluator"
}
