{
  "version": "0.1",
  "run_id": "run_61faeb1762",
  "kernel_version": "0.1",
  "artifacts": [
    {
      "path": "datasets/runs/meta_eval/scenario_lab_profile_v0/collapse_sweep/drop_0.25/seed_9/trace.json",
      "sha256": "917e395d533fa600dde541f668dfbbd8564698e87d54fc0531789339a8562141",
      "schema_id": "https://example.org/labtrust/kernel/trace/TRACE.v0.1"
    },
    {
      "path": "datasets/runs/meta_eval/scenario_lab_profile_v0/collapse_sweep/drop_0.25/seed_9/maestro_report.json",
      "sha256": "a47c6fc61ff22f218bc343286ff4f54288e64ca21c37e1e687bbff5c5164da6b",
      "schema_id": "https://example.org/labtrust/kernel/eval/MAESTRO_REPORT.v0.2"
    }
  ],
  "verification": {
    "schema_validation_ok": true,
    "replay_ok": true,
    "replay_diagnostics": "replay ok"
  },
  "verification_mode": "evaluator"
}
